Name,Funding,Department
State Survey Certifcation of Health Care Providers and Suppliers (Title XIX) Medicaid ,309000000,Department of Health and Human Services
State Vital Statistics Improvement Program ,720000,Department of Health and Human Services
States Advancing All-Payer Health Equity Approaches and Development (AHEAD) Model ,13000000,Department of Health and Human Services
Stephanie Tubbs Jones Child Welfare Services Program ,269000000,Department of Health and Human Services
Strengthening Emergency Care Delivery in the U.S. Healthcare System through Health Information and Promotion,0,Department of Health and Human Services
Strengthening Emergency Care Delivery in the United States Health Care System through Health Information and Promotion ,50000,Department of Health and Human Services
Strengthening Public Health Systems and Services through National Partnerships to Improve and Protect the Nations Health ,201000000,Department of Health and Human Services
"Strengthening Public Health through Surveillance, Epidemiologic Research, Disease Detection and Prevention ",17000000,Department of Health and Human Services
"Strengthening the Nations Public Health System through a National Voluntary Accreditation Program for State, Tribal, Local and Territorial Health Departments ",1000000,Department of Health and Human Services
Strengthening the Public Health System in Affliated Pacifc Islands ,6000000,Department of Health and Human Services
Strengthening the Technical Advancement & Readiness of Public Health via Health Information Exchange Program,0,Department of Health and Human Services
Substance Abuse and Mental Health Services Projects of Regional and National Signifcance ,2100000000,Department of Health and Human Services
Support for Ombudsman and Benefciary Counseling Programs for States Participating in Financial Alignment Model Demonstrations for Dually Eligible Individuals ,112000,Department of Health and Human Services
Supporting and Maintaining a Surveillance System for Chronic Kidney Disease (CKD) ,1000000,Department of Health and Human Services
Surplus Property Utilization,0,Department of Health and Human Services
Teaching Health Center Graduate Medical Education Payment ,116000000,Department of Health and Human Services
Technical and Non-Financial Assistance to Health Centers ,135000000,Department of Health and Human Services
Technical Assistance and Provision for Foreign Hospitals and Health Organizations,0,Department of Health and Human Services
Technical Assistance to Increase Tobacco Cessation ,900000,Department of Health and Human Services
Teenage Pregnancy Prevention Program ,92000000,Department of Health and Human Services
Telehealth Programs ,36000000,Department of Health and Human Services
Temporary Assistance for Needy Families ,17100000000,Department of Health and Human Services
"The Healthy Brain Initiative: Technical Assistance to Implement Public Health Actions related to Cognitive Health, Cognitive Impairment and Caregiving at the State and Local Levels ",23000000,Department of Health and Human Services
The National Cardiovascular Health Program ,76000000,Department of Health and Human Services
The Reduction of Issuer Burden Through Technology Grant Program and rhe Health Insurance Enforcement and Consumer Protections Grant Program,0,Department of Health and Human Services
The State Flexibility to Stabilize the Market Grant Program,0,Department of Health and Human Services
Title IV-E Kinship Navigator Program ,17000000,Department of Health and Human Services
Title IV-E Prevention Program ,169000000,Department of Health and Human Services
Title V Sexual Risk Avoidance Education Program (Discretionary Grants) ,12000000,Department of Health and Human Services
Title V State Sexual Risk Avoidance Education (Title V State SRAE) Program ,48000000,Department of Health and Human Services
Tobacco Prevention and Control Legal Technical Assistance ,385000,Department of Health and Human Services
Tracking Electronic Health Record Adoption and Capturing Related Insights in U.S. Hospitals,0,Department of Health and Human Services
"Training in General, Pediatric and Public Health Dentistry ",23000000,Department of Health and Human Services
Trans-NIH Research Support ,1200000000,Department of Health and Human Services
Transforming Maternal Health (TMH) Model,0,Department of Health and Human Services
Transitional Living for Homeless Youth ,51000000,Department of Health and Human Services
"Translation and Implementation Science Research for Heart, Lung, Blood Diseases, and Sleep Disorders ",69000000,Department of Health and Human Services
Traumatic Brain Injury State Demonstration Grant Program,0,Department of Health and Human Services
"Tribal Maternal, Infant and Early Childhood Home Visiting ",31000000,Department of Health and Human Services
Tribal Public Health Capacity Building and Quality Improvement Umbrella Cooperative Agreement ,26000000,Department of Health and Human Services
Tribal Self-Governance Program: IHS Compacts/Funding Agreements ,2900000000,Department of Health and Human Services
Tribal Self-Governance Program: Planning and Negotiation Cooperative Agreement ,1000000,Department of Health and Human Services
Tribal Work Grants ,8000000,Department of Health and Human Services
Trusted Exchange Framework and Common Agreement (TEFCA) Recognized Coordinating Entity (RCE) Cooperative Agreement,0,Department of Health and Human Services
"Tuberculosis Demonstration, Research, Public and Professional Education ",5000000,Department of Health and Human Services
U.S. Repatriation ,3000000,Department of Health and Human Services
Unaccompanied Children Program ,3500000000,Department of Health and Human Services
Undergraduate Scholarship Program for Individuals from Disadvantaged Backgrounds ,5000000,Department of Health and Human Services
"University Centers for Excellence in Developmental Disabilities Education, Research and Service",0,Department of Health and Human Services
Urban Indian Health Services ,11000000,Department of Health and Human Services
Viral Hepatitis Prevention and Control ,25000000,Department of Health and Human Services
Vision Research ,698000000,Department of Health and Human Services
Voting Access for Individuals with Disabilities-Grants for Protection and Advocacy Systems,0,Department of Health and Human Services
"Welfare Reform Research, Evaluations and National Studies ",4000000,Department of Health and Human Services
Well-Integrated Screening and Evaluation for Women Across the Nation (WISEWOMAN) ,23000000,Department of Health and Human Services
Alliance for System Safety of Unmanned Aircraft Systems through Research Excellence ,2000000,Department of Homeland Security
Assistance to Firefghters Grant ,370000000,Department of Homeland Security
Boating Safety Data Collection and Analysis Grant Program ,2000000,Department of Homeland Security
Boating Safety Financial Assistance ,118000000,Department of Homeland Security
BRIC: Building Resilient Infrastructure and Communities,0,Department of Homeland Security
Case Management Pilot Program ,15000000,Department of Homeland Security
Centers for Homeland Security ,42000000,Department of Homeland Security
Chemical Stockpile Emergency Preparedness Program ,26000000,Department of Homeland Security
CISA Cyber Security Awareness Campaign ,550000,Department of Homeland Security
Citizenship Education and Training ,100000,Department of Homeland Security
Citizenship Integration Training Academy ,3000000,Department of Homeland Security
Community Assistance Program State Support Services Element (CAP-SSSE) ,19000000,Department of Homeland Security
Community Disaster Loans ,111000000,Department of Homeland Security
Cooperating Technical Partners ,95000000,Department of Homeland Security
Crisis Counseling ,72000000,Department of Homeland Security
Cybersecurity Education and Training ,7000000,Department of Homeland Security
Cybersecurity Workforce Development and Training for Underserved Communities Program ,3000000,Department of Homeland Security
CyberTipline ,305000,Department of Homeland Security
Disaster Assistance Projects ,46000000,Department of Homeland Security
Disaster Grants: Public Assistance (Presidentially Declared Disasters) ,30400000000,Department of Homeland Security
Disaster Legal Services ,100000,Department of Homeland Security
Disaster Unemployment Assistance ,17000000,Department of Homeland Security
Drivers License Security Grant Program,0,Department of Homeland Security
Earthquake State Assistance ,3000000,Department of Homeland Security
Emergency Food and Shelter National Board Program ,130000000,Department of Homeland Security
Emergency Management Baseline Assessments Grant (EMBAG) ,2000000,Department of Homeland Security
Emergency Management Performance Grants ,710000000,Department of Homeland Security
Emergency Operations Center,0,Department of Homeland Security
Federal Disaster Assistance to Individuals and Households in Presidential Declared Disaster Areas ,1600000000,Department of Homeland Security
Financial Assistance for Targeted Violence and Terrorism Prevention ,20000000,Department of Homeland Security
Fire Management Assistance Grant ,101000000,Department of Homeland Security
Fire Prevention & Safety ,32000000,Department of Homeland Security
Flood Insurance ,3600000000,Department of Homeland Security
Flood Mitigation Assistance ,650000000,Department of Homeland Security
Flood Mitigation Assistance (FMA) Swift Current ,90000000,Department of Homeland Security
FY 2022 Operation Allies Welcome Airport Assistance Grant,0,Department of Homeland Security
Hazard Mitigation Grant ,2300000000,Department of Homeland Security
Homeland Security Biowatch Program ,34000000,Department of Homeland Security
Homeland Security Grant Program ,120000000,Department of Homeland Security
Homeland Security Preparedness Technical Assistance Program ,525000,Department of Homeland Security
"Homeland Security Research, Development, Testing, Evaluation and Demonstration of Technologies Related to Countering Weapons of Mass Destruction ",6000000,Department of Homeland Security
Intercity Bus Security Grants,0,Department of Homeland Security
National Coast Guard Museum Construction,0,Department of Homeland Security
National Computer Forensics Institute Facility Expansion Grant Program ,22000000,Department of Homeland Security
National Cybersecurity Preparedness Consortium ,8000000,Department of Homeland Security
National Dam Safety Program ,217000000,Department of Homeland Security
National Domestic Preparedness Consortium ,70000000,Department of Homeland Security
National Earthquake Hazards Reduction Program (NEHRP) Multi-State and National Assistance (MSNEA) Grant Program ,1000000,Department of Homeland Security
National Fire Academy Training Assistance ,2000000,Department of Homeland Security
National Incident Management System (NIMS) ,2000000,Department of Homeland Security
National Nonproft Organization Recreational Boating Safety Grant Program ,6000000,Department of Homeland Security
National Nuclear Forensics Expertise Development Program ,2000000,Department of Homeland Security
National Urban Search and Rescue (US&R) Response System,37000000,Department of Homeland Security
Next Generation Warning System Grant Program,0,Department of Homeland Security
Non-Proft Security Program ,360000000,Department of Homeland Security
Port Security Grant Program ,100000000,Department of Homeland Security
Pre-Disaster Mitigation (PDM) Congressionally Directed Spending (CDS) ,191000000,Department of Homeland Security
Preparing for Emerging Threats and Hazards,0,Department of Homeland Security
Presidential Declared Disaster Assistance to Individuals and Households  Other Needs,0,Department of Homeland Security
Presidential Residence Protection Security Grant,0,Department of Homeland Security
"Public Safety and Violence Prevention Research, Evaluation and Implementation ",1000000,Department of Homeland Security
Rail and Transit Security Grant Program ,100000000,Department of Homeland Security
Regional Catastrophic Preparedness Grant Program (RCPGP) ,12000000,Department of Homeland Security
Rehabilitation of High Hazard Potential Dams Grant Program ,185000000,Department of Homeland Security
Rural Emergency Medical Communications Demonstration Project ,1000000,Department of Homeland Security
Safeguarding Tomorrow Revolving Loan Fund Program,0,Department of Homeland Security
Scientifc Leadership Awards,0,Department of Homeland Security
Securing the Cities Program ,28000000,Department of Homeland Security
Shelter and Services Program ,8000000000,Department of Homeland Security
Shelter and Services Program (SSP-C) ,341000000,Department of Homeland Security
Staffng for Adequate Fire and Emergency Response (SAFER) ,370000000,Department of Homeland Security
State and Local Cybersecurity Grant Program Tribal Cybersecurity Grant Program ,300000000,Department of Homeland Security
State and Local Homeland Security National Training Program ,91000000,Department of Homeland Security
State Fire Training Systems Grants ,1000000,Department of Homeland Security
"State, Local, Tribal and Territorial Security Operations Center/Information Sharing and Analysis Center ",27000000,Department of Homeland Security
Tribal Cybersecurity Grant Program ,12000000,Department of Homeland Security
Tribal Homeland Security Grant Program ,14000000,Department of Homeland Security
Adjustable Rate Mortgages,0,Department of Housing and Urban Development
Affordable Housing Development in Main Street Rejuvenation Projects ,2000000,Department of Housing and Urban Development
Choice Neighborhoods Implementation Grants ,328000000,Department of Housing and Urban Development
Choice Neighborhoods Planning Grants ,7000000,Department of Housing and Urban Development
Community Compass Technical Assistance and Capacity Building ,69000000,Department of Housing and Urban Development
Community Development Block Grant- PRICE Competition,0,Department of Housing and Urban Development
Community Development Block Grant- PRO Housing Competition ,85000000,Department of Housing and Urban Development
Community Development Block Grants Section 108 Loan Guarantees ,400000000,Department of Housing and Urban Development
Community Development Block Grants/Entitlement Grants ,2500000000,Department of Housing and Urban Development
Community Development Block Grants/Special Purpose Grants/Insular Areas ,7000000,Department of Housing and Urban Development
Community Development Block Grants/States program and Non-Entitlement Grants in Hawaii ,4900000000,Department of Housing and Urban Development
Continuum of Care Program ,3200000000,Department of Housing and Urban Development
Demolition and Revitalization of Severely Distressed Public Housing,0,Department of Housing and Urban Development
Dollar Home Sales,0,Department of Housing and Urban Development
"Economic Development Initiative, Community Project Funding, and Miscellaneous grants",0,Department of Housing and Urban Development
Education and Outreach Initiatives ,10000000,Department of Housing and Urban Development
Emergency Solutions Grant Program ,290000000,Department of Housing and Urban Development
Eviction Protection Grant Program ,30000000,Department of Housing and Urban Development
Fair Housing Assistance Program ,25000000,Department of Housing and Urban Development
Fair Housing Initiatives Program ,39000000,Department of Housing and Urban Development
Fair Housing Organization Initiatives ,4000000,Department of Housing and Urban Development
Family Self-Suffciency Program ,133000000,Department of Housing and Urban Development
Family Unifcation Program (FUP),0,Department of Housing and Urban Development
General Research and Technology Activity ,20000000,Department of Housing and Urban Development
Good Neighbor Next Door Sales Program,0,Department of Housing and Urban Development
Green and Resilient Retroft Program ,87000000,Department of Housing and Urban Development
Healthy Homes Production Program ,45000000,Department of Housing and Urban Development
Healthy Homes Technical Studies Grants ,5000000,Department of Housing and Urban Development
Healthy Homes Weatherization Cooperation Demonstration Grants ,7000000,Department of Housing and Urban Development
Home Equity Conversion Mortgages ,26000000,Department of Housing and Urban Development
Home Investment Partnerships Program ,1200000000,Department of Housing and Urban Development
Housing Counseling Assistance Program ,61000000,Department of Housing and Urban Development
Housing Counseling Program Homeownership Initiative ,61000000,Department of Housing and Urban Development
Housing Counseling Training Program ,5000000,Department of Housing and Urban Development
Housing Finance Agencies (HFA) Risk Sharing,0,Department of Housing and Urban Development
Housing Opportunities for Persons with AIDS ,453000000,Department of Housing and Urban Development
Housing Trust Fund ,217000000,Department of Housing and Urban Development
Hurricane Sandy Community Development Block Grant Disaster Recovery Grants (CDBG-DR),0,Department of Housing and Urban Development
Indian Community Development Block Grant Program ,72000000,Department of Housing and Urban Development
Indian Housing Block Grants ,1300000000,Department of Housing and Urban Development
Jobs-Plus Pilot Initiative ,31000000,Department of Housing and Urban Development
Lead Hazard Control Capacity Building ,10000000,Department of Housing and Urban Development
Lead Hazard Control for High Risk Areas,0,Department of Housing and Urban Development
Lead Hazard Reduction Demonstration Grant Program ,129000000,Department of Housing and Urban Development
Lead Hazard Reduction Grant Program ,205000000,Department of Housing and Urban Development
Lead Technical Studies Grants ,2000000,Department of Housing and Urban Development
Lead-Based Paint Capital Fund Program ,88000000,Department of Housing and Urban Development
Loan Guarantees for Native Hawaiian Housing ,3000000,Department of Housing and Urban Development
Lower Income Housing Assistance Program Section 8 Moderate Rehabilitation ,93000000,Department of Housing and Urban Development
Mainstream Vouchers ,626000000,Department of Housing and Urban Development
Manufactured Home Loan Insurance (Title I) ,4000000,Department of Housing and Urban Development
Manufactured Housing ,14000000,Department of Housing and Urban Development
Mortgage Insurance Combination and Manufactured Home Lot Loans,0,Department of Housing and Urban Development
Mortgage Insurance Cooperative Projects,0,Department of Housing and Urban Development
Mortgage Insurance for the Purchase or Refnancing of Existing Multifamily Housing Projects,0,Department of Housing and Urban Development
Mortgage Insurance Homes ,225000000,Department of Housing and Urban Development
Mortgage Insurance Homes for Disaster Victims,0,Department of Housing and Urban Development
Mortgage Insurance Homes in Urban Renewal Areas,0,Department of Housing and Urban Development
Mortgage Insurance Hospitals ,960000000,Department of Housing and Urban Development
"Mortgage Insurance Nursing Homes, Intermediate Care Facilities, Board and Care Homes and Assisted Living Facilities ",3100000000,Department of Housing and Urban Development
Mortgage Insurance Purchase of Units in Condominiums,0,Department of Housing and Urban Development
"Mortgage Insurance Rental and Cooperative Housing for Moderate Income Families and Elderly, Market Interest Rate",0,Department of Housing and Urban Development
Mortgage Insurance Rental Housing ,17500000000,Department of Housing and Urban Development
Mortgage Insurance Rental Housing for the Elderly,0,Department of Housing and Urban Development
Mortgage Insurance Rental Housing in Urban Renewal Areas,0,Department of Housing and Urban Development
Moving to Work Demonstration Program,0,Department of Housing and Urban Development
Multifamily Housing Service Coordinators ,112000000,Department of Housing and Urban Development
National Disaster Resilience Competition,0,Department of Housing and Urban Development
National Homeless Data Analysis Project (NHDAP) ,9000000,Department of Housing and Urban Development
Native Hawaiian Housing Block Grants ,22000000,Department of Housing and Urban Development
Neighborhood Stabilization Program (Recovery Act Funded),0,Department of Housing and Urban Development
Offce of Native American Programs Training and Technical Assistance for Indian Housing Block Grant Program,0,Department of Housing and Urban Development
Older Adults Home Modifcation Grant Program ,30000000,Department of Housing and Urban Development
Performance Based Contract Administrator Program ,448000000,Department of Housing and Urban Development
Private Enforcement Initiatives ,25000000,Department of Housing and Urban Development
Project Rental Assistance Demonstration (PRA Demo) Program of Section 811 Supportive Housing for Persons with Disabilities ,148000000,Department of Housing and Urban Development
Project-Based Rental Assistance (PBRA) ,14700000000,Department of Housing and Urban Development
"The White House budget offce said that rental assistance would not be affected, but it did not specify individual programs. Property Improvement Loan Insurance for Improving All Existing Structures and Building of New Nonresidential Structures",16000000,Department of Housing and Urban Development
Public and Indian Housing Indian Loan Guarantee Program ,342000000,Department of Housing and Urban Development
Public Housing Capital Fund ,3200000000,Department of Housing and Urban Development
Public Housing Operating Fund ,5500000000,Department of Housing and Urban Development
Radon Interventions in Public and Assisted Multifamily Housing,0,Department of Housing and Urban Development
Rehabilitation Mortgage Insurance,0,Department of Housing and Urban Development
"Research, Evaluation, and Demonstrations ",16000000,Department of Housing and Urban Development
Resident Opportunity and Supportive Services - Service Coordinators ,40000000,Department of Housing and Urban Development
Rural Capacity Building for Community Development and Affordable Housing Grants ,6000000,Department of Housing and Urban Development
Section 4 Capacity Building for Community Development and Affordable Housing ,83000000,Department of Housing and Urban Development
Section 8 Housing Choice Vouchers ,31700000000,Department of Housing and Urban Development
Section 8 Moderate Rehabilitation Single Room Occupancy,0,Department of Housing and Urban Development
Self-Help Homeownership Opportunity Program ,12000000,Department of Housing and Urban Development
Single Family Property Disposition,0,Department of Housing and Urban Development
Supplemental Loan Insurance Multifamily Rental Housing,0,Department of Housing and Urban Development
Supportive Housing for Persons with Disabilities ,148000000,Department of Housing and Urban Development
Supportive Housing for the Elderly ,110000000,Department of Housing and Urban Development
Tenant Education and Outreach Program,0,Department of Housing and Urban Development
Title VI Federal Guarantees for Financing Tribal Housing Activities ,10000000,Department of Housing and Urban Development
Tribal HUD-VA Supportive Housing Program ,10000000,Department of Housing and Urban Development
Veterans Housing Rehabilitation and Modifcation Program ,9000000,Department of Housing and Urban Development
Youth Homeless System Improvement Grants,0,Department of Housing and Urban Development
Youth Homelessness Demonstration Program ,124000000,Department of Housing and Urban Development
Academic-based Drug Field Testing and Training Initiative,0,Department of Justice
Antiterrorism Emergency Reserve ,50000000,Department of Justice
Body Worn Camera Policy and Implementation ,9000000,Department of Justice
Bulletproof Vest Partnership Program ,24000000,Department of Justice
Byrne Criminal Justice Innovation Program,0,Department of Justice
Capital Case Litigation Initiative ,8000000,Department of Justice
Children Exposed to Violence ,9000000,Department of Justice
Children of Incarcerated Parents ,5000000,Department of Justice
Childrens Justice Act Partnerships for Indian Communities ,4000000,Department of Justice
Combatting Contraband Cell Phone Use in Prisons,0,Department of Justice
Combined DNA Index System,0,Department of Justice
Community-Based Approaches to Advancing Justice ,8000000,Department of Justice
Community-Based Violence Intervention and Prevention Initiative ,87000000,Department of Justice
Community-Based Violence Prevention Program ,50000000,Department of Justice
Comprehensive Forensic DNA Analysis Grant Program ,105000000,Department of Justice
"Comprehensive Opioid, Stimulant, and other Substances Use Program ",26000000,Department of Justice
Congressionally Recommended Awards ,348000000,Department of Justice
Consolidated and Technical Assistance Grant Program to Address Children and Youth Experiencing Domestic and Sexual Violence and Engage Men and Boys as Allies ,12000000,Department of Justice
Coronavirus Emergency Supplemental Funding Program,0,Department of Justice
Corrections Research and Evaluation and Policy Formulation,0,Department of Justice
Corrections Technical Assistance/Clearinghouse,0,Department of Justice
Corrections Training and Staff Development,0,Department of Justice
Court Appointed Special Advocates ,15000000,Department of Justice
Crime Gun Intelligence Training and Education,0,Department of Justice
Crime Victim Assistance,0,Department of Justice
Crime Victim Assistance/Discretionary Grants,0,Department of Justice
Crime Victim Compensation,0,Department of Justice
